,title,rating,num_ratings,num_reviews,num_awards,language,num_page,cover_type,published_year,genre,author
899,Forty-One False Starts: Essays on Artists and Writers,3.94,635,82,2.0,English,320 pages,Hardcover,"Published May 7th 2013 by Farrar, Straus and Giroux (first published April 24th 2013)",Writing,Janet Malcolm
900,The One and Only Ivan,4.27,170491,17179,10.0,English,307 pages,Hardcover,Published January 17th 2012 by HarperCollins,Childrens,Katherine Applegate
901,Methods and Theories of Art History,3.97,368,29,,English,192 pages,Paperback,Published September 9th 2009 by Laurence King Publishing (first published February 7th 2005),Art,Anne D'Alleva
902,"Art Lab for Kids: 52 Creative Adventures in Drawing, Painting, Printmaking, Paper, and Mixed Media-For Budding Artists of All Ages",4.10,706,42,,English,144 pages,Paperback,Published February 1st 2012 by Quarry Books (first published January 1st 2012),Art,Susan Schwake
903,The Complete Watercolorist's Essential Notebook: A Treasury of Watercolor Secrets Discovered Through Decades of Painting and Experimentation,4.42,337,23,,English,288 pages,Hardcover,Published October 19th 2010 by North Light Books,Art,Gordon MacKenzie
904,"The Art of Gothic: Architecture, Sculpture, Painting",4.33,207,14,,English,520 pages,Hardcover,Published March 28th 1999 by Konemann,Art,Rolf Toman
905,Bridget's Beret,4.11,883,168,,English,40 pages,Hardcover,Published April 27th 2010 by Henry Holt & Company,Childrens,Tom Lichtenheld
906,The Skillful Huntsman: Visual Development of a Grimm Tale at Art Center College of Design,4.51,354,14,,English,160 pages,Paperback,Published May 1st 2005 by Design Studio Press,Art,Khang Le
907,Saddest Place on Earth,4.26,598,19,,English,100 pages,Paperback,Published February 25th 2015 by Last Gasp (first published June 11th 2005),Art,Camille Rose Garcia
908,One Hundred Demons,4.18,8865,663,2.0,English,224 pages,Paperback,Published August 30th 2005 by Sasquatch Books (first published August 13th 2002),Sequential Art,Lynda Barry
909,How to Make a Journal of Your Life,4.12,5457,79,,,128 pages,Paperback,Published September 1st 1999 by Ten Speed Press (first published August 1999),Art,Dan Price
910,The Goblins of Labyrinth,4.47,1160,54,,English,160 pages,Hardcover,Published September 1st 2006 by Harry N. Abrams (first published 1986),Fantasy,Brian Froud
911,Cartoon Animation,4.32,1121,29,,English,224 pages,Paperback,Published 1994 by Walter Foster Publishing (first published 1980),Art,Preston Blair
912,Discovering Great Artists: Hands-On Art for Children in the Styles of the Great Masters,4.23,458,32,2.0,English,144 pages,Paperback,Published May 1st 1997 by Chicago Review Press (first published January 1st 1997),Art,MaryAnn F. Kohl
913,Expressionism: A Revolution in German Art,4.18,135,7,,English,256 pages,Hardcover,Published January 1st 2007 by Taschen (first published February 1st 1994),Art,Dietmar Elger
914,Performance Art: From Futurism to the Present,3.95,422,21,,English,232 pages,Paperback,Published June 17th 2001 by Thames Hudson (first published January 1st 1979),Art,Roselee Goldberg
915,Obey: Supply and Demand,4.08,2829,25,,English,349 pages,Hardcover,Published July 1st 2006 by Gingko Pr Inc,Art,Shepard Fairey
916,National Geographic The Photographs,4.35,2607,80,,English,400 pages,Hardcover,Published October 1st 1994 by National Geographic,Art,Leah Bendavid-Val
917,Janson's History of Art: The Western Tradition,4.25,533,23,,English,1111 pages,Hardcover,Published February 1st 2006 by Prentice Hall (first published 2001),Art,H.W. Janson
918,Friedrich,4.14,167,11,,English,96 pages,Paperback,Published March 1st 2003 by Taschen (first published January 1st 2003),Art,Norbert Wolf
919,Kusama: The Graphic Novel,4.00,1490,304,,English,128 pages,Hardcover,Published September 15th 2020 by Laurence King Publishing (first published March 18th 2020),Sequential Art,Elisa Macellari
920,"The Book of Kells: An Illustrated Introduction to the Manuscript in Trinity College, Dublin",4.13,582,42,,English,96 pages,Paperback,Published February 17th 1995 by Thames Hudson (first published November 1994),Art,Bernard Meehan
921,A Month in Siena,4.06,1767,261,,English,128 pages,Hardcover,Published October 17th 2019 by Viking,Nonfiction,Hisham Matar
922,The Great Believers,4.26,107692,10518,6.0,English,421 pages,Paperback,Published June 4th 2019 by Penguin Books (first published June 19th 2018),Fiction,Rebecca Makkai
923,The Dance of Death,4.26,287,38,,English,160 pages,Paperback,Published June 1st 1971 by Dover Publications (first published 1538),Art,Hans Holbein
924,A Brief History of Curating,3.89,334,13,,English,243 pages,Paperback,Published October 1st 2008 by JRP Ringier,Art,Hans Ulrich Obrist
925,"Paul Klee, 1879-1940",3.94,193,12,,English,96 pages,Paperback,Published September 1st 1994 by Taschen (first published 1991),Art,Paul Klee
926,You Must Change Your Life: The Story of Rainer Maria Rilke and Auguste Rodin,4.14,673,119,,,320 pages,Paperback,Published October 10th 2017 by W. W. Norton Company (first published 2016),Art,Rachel Corbett
927,The Painter,3.81,14593,1827,1.0,English,364 pages,Hardcover,Published May 6th 2014 by Knopf,Fiction,Peter Heller
928,The House Girl,3.77,60368,5640,1.0,English,370 pages,Hardcover,Published February 12th 2013 by William Morrow,Historical,Tara Conklin
929,Press Here,4.42,23521,1894,2.0,English,56 pages,Hardcover,Published March 30th 2011 by Chronicle Books (first published January 28th 2010),Childrens,Hervé Tullet
930,Diego Rivera: His World and Ours,3.87,689,224,2.0,English,40 pages,Hardcover,Published May 1st 2011 by Harry N. Abrams,Biography,Duncan Tonatiuh
931,Asterios Polyp,4.21,26322,1760,6.0,English,324 pages,Hardcover,Published July 7th 2009 by Pantheon,Sequential Art,David Mazzucchelli
932,Degas and the Little Dancer: A story about Edgar Degas,4.17,393,52,,English,32 pages,Paperback,Published September 1st 2003 by Frances Lincoln Ltd (first published 1996),Art,Laurence Anholt
933,One Place After Another: Site-Specific Art and Locational Identity,4.11,366,15,,,218 pages,Paperback,Published February 27th 2004 by MIT Press (first published June 21st 2002),Art,Miwon Kwon
934,The Fantastic Art of Beksinski,4.60,306,16,,English,80 pages,Hardcover,Published December 8th 1998 by Morpheus International,Art,Zdzisław Beksiński
935,The Art of the Renaissance,3.50,135,10,,English,288 pages,Paperback,Published February 17th 1985 by Thames Hudson (first published 1963),Art,Peter Murray
936,The Art of The Incredibles,4.26,1671,21,,English,160 pages,Hardcover,Published September 30th 2004 by Chronicle Books,Art,Mark Cotta Vaz
937,When Pigasso Met Mootisse,3.99,719,129,,English,34 pages,Hardcover,Published July 1st 1998 by Chronicle Books,Childrens,Nina Laden
938,Conceptual Art,4.15,249,14,,English,448 pages,Paperback,Published November 6th 1998 by Phaidon Press,Art,Tony Godfrey
939,The Doubtful Guest,4.42,4232,203,,English,32 pages,Hardcover,Published June 15th 1998 by Houghton Mifflin Harcourt (first published 1957),Humor,Edward Gorey
940,Goblins! A Survival Guide and Fiasco in Four Parts,4.20,2446,34,,English,88 pages,Hardcover,Published October 13th 2004 by Harry N. Abrams (first published 2004),Fantasy,Brian Froud
941,The Sketchnote Handbook: The Illustrated Guide to Visual Note Taking,4.07,3367,312,,,224 pages,Paperback,Published December 3rd 2012 by Peachpit Press,Nonfiction,Mike Rohde
942,A Big Important Art Book (Now with Women): Profiles of Unstoppable Female Artists--and Projects to Help You Become One,4.43,276,24,,,320 pages,Hardcover,Published October 2nd 2018 by Running Press Adult,Art,Danielle Krysa
943,Artemisia Gentileschi,4.38,279,11,,English,664 pages,Paperback,Published January 21st 1991 by Princeton University Press (first published January 1st 1989),Art,Mary D. Garrard
944,Herding Cats,4.14,20359,2831,1.0,English,112 pages,Paperback,Published March 27th 2018 by Andrews McMeel Publishing,Sequential Art,Sarah Andersen
945,Maya Lin: Artist-Architect of Light and Lines,4.34,856,154,,,32 pages,Hardcover,Published May 2nd 2017 by Christy Ottaviano Books,Childrens,Jeanne Walker Harvey
946,In Mary's Garden,3.85,393,89,,,32 pages,Hardcover,Published March 17th 2015 by Clarion Books,Childrens,Tina Kugler
947,The Marvels,3.99,19461,3072,2.0,English,664 pages,Hardcover,Published September 15th 2015 by Scholastic Press,Childrens,Brian Selznick
948,The Art of Big Hero 6,4.45,1020,54,,,159 pages,Hardcover,Published October 28th 2014 by Chronicle Books (first published October 21st 2014),Art,Jessica Julius
949,Symbolism,4.13,205,9,,English,256 pages,Hardcover,Published December 1st 1999 by Taschen (first published January 1st 1999),Art,Michael Gibson
950,Edward Hopper Paints His World,4.04,404,82,,,40 pages,Hardcover,Published August 19th 2014 by Henry Holt and Co. (BYR),Childrens,Robert Burleigh
951,Brush of the Gods,3.95,585,134,,English,40 pages,Hardcover,Published June 25th 2013 by Schwartz & Wade (first published January 1st 2013),Childrens,Lenore Look
952,Building Stories,4.32,6948,758,6.0,English,260 pages,Hardcover,Published October 2nd 2012 by Pantheon,Sequential Art,Chris Ware
953,Tell the Wolves I'm Home,4.03,136477,15326,2.0,English,360 pages,Hardcover,Published June 19th 2012 by Random House,Fiction,Carol Rifka Brunt
954,Renaissance Art: A Very Short Introduction,3.69,234,28,,English,158 pages,Paperback,"Published July 28th 2005 by Oxford University Press, USA (first published April 21st 2005)",Art,Geraldine A. Johnson
955,Desperate Romantics: The Private Lives Of The Pre Raphaelites,4.01,469,62,,English,352 pages,Hardcover,Published January 8th 2009 by John Murray,Nonfiction,Franny Moyle
956,Lives of the Artists: Portraits of Ten Artists Whose Work and Lifestyles Embody the Future of Contemporary Art,4.08,555,40,,English,272 pages,Hardcover,Published October 28th 2008 by Henry Holt and Co.,Art,Calvin Tomkins
957,J.C. Leyendecker,4.63,247,25,,English,288 pages,Hardcover,Published November 1st 2008 by Harry N. Abrams,Art,Laurence S. Cutler
958,Toulouse-Lautrec,4.22,341,10,,,95 pages,Paperback,Published January 28th 2005 by Taschen America Llc (first published January 1st 1990),Art,Matthias Arnold
959,Greek Art,3.90,227,14,,English,304 pages,Paperback,Published November 17th 1996 by Thames Hudson (first published 1964),Art,John Boardman
960,Classical Painting Atelier: A Contemporary Guide to Traditional Studio Practice,4.42,407,20,,English,256 pages,Hardcover,Published April 1st 2008 by Watson-Guptill (first published April 1st 2007),Art,Juliette Aristides
961,John Singer Sargent,4.45,250,18,,English,256 pages,Hardcover,Published September 1st 2001 by Abbeville Press (first published January 1st 1986),Art,Carter Ratcliff
962,The Hundred Headless Woman,4.36,251,29,,,328 pages,Paperback,Published September 1st 1981 by George Braziller (first published 1929),Art,Max Ernst
963,Leonardo da Vinci: Flights of the Mind,4.01,1400,98,,English,502 pages,Paperback,Published November 29th 2005 by Penguin Books (first published 2004),Biography,Charles Nicholl
964,"Vision and Difference: Femininity, Feminism and Histories of Art",4.10,330,17,,English,239 pages,Paperback,Published July 11th 1988 by Routledge (first published February 1st 1988),Art,Griselda Pollock
965,Ed Emberley's Drawing Book: Make a World,4.47,670,36,,English,32 pages,Paperback,"Published April 5th 2006 by L,B Kids (first published April 1st 1972)",Art,Ed Emberley
966,The Morning Star: In Which the Extraordinary Correspondence of Griffin & Sabine is Illuminated,4.11,2073,127,,English,60 pages,Hardcover,Published July 1st 2003 by Chronicle Books (first published January 1st 2003),Fiction,Nick Bantock
967,Essential Dali (256 Art Books),4.22,314,13,,English,,Hardcover,Published August 1st 1999 by Parragon,Art,Kirsten Bradbury
968,Beautiful Losers: Contemporary Art and Street Culture,4.10,1327,17,,English,256 pages,Paperback,Published October 15th 2005 by Distributed Art Publishers (DAP) (first published 2004),Art,Aaron Rose
969,Acrylic Revolution: New Tricks and Techniques for Working with the World's Most Versatile Medium,4.14,728,32,,English,128 pages,Hardcover,Published March 30th 2007 by North Light Books (first published March 16th 2007),Art,Nancy Reyner
970,Japanese Art,3.53,226,18,,English,224 pages,Paperback,Published April 17th 2000 by Thames Hudson (first published 1984),Art,Joan Stanley-Baker
971,The Last Leonardo: The Secret Lives of the World's Most Expensive Painting,3.83,801,126,,English,384 pages,Hardcover,Published June 25th 2019 by Ballantine Books,Nonfiction,Ben Lewis
972,"Art History, Volume I (w/CD-ROM)",3.93,550,18,,English,672 pages,Paperback,Published July 16th 2004 by Prentice Hall (first published July 27th 1995),Art,Marilyn Stokstad
973,"Hot, Cold, Heavy, Light, 100 Art Writings 1988-2018",4.41,240,36,1.0,English,404 pages,Hardcover,Published June 4th 2019 by Harry N. Abrams,Art,Peter Schjeldahl
974,Your Art Will Save Your Life,3.78,755,112,,English,136 pages,Paperback,Published April 10th 2018 by The Feminist Press at CUNY,Art,Beth Pickens
975,The Italian Teacher,3.66,7091,915,1.0,English,340 pages,Hardcover,Published February 20th 2018 by Riverrun,Fiction,Tom Rachman
976,Auguste Rodin,4.16,455,42,,English,88 pages,Hardcover,Published March 1st 2004 by Archipelago Books (first published 1903),Art,Rainer Maria Rilke
977,"Story: Substance, Structure, Style, and the Principles of Screenwriting",4.27,14706,1358,,English,466 pages,Hardcover,Published November 25th 1997 by It Books (first published 1997),Language,Robert McKee
978,معنی هنر,3.69,279,10,,Persian,,,,Art,Herbert Read
979,Peacock & Vine: On William Morris and Mariano Fortuny,3.61,535,107,,English,208 pages,Hardcover,Published August 2nd 2016 by Alfred A. Knopf (first published July 7th 2016),Art,A.S. Byatt
980,Awkward,4.17,45036,2394,3.0,English,224 pages,Paperback,Published July 21st 2015 by JY,Sequential Art,Svetlana Chmakova
981,"Matisse the Master: The Conquest of Colour, 1909-1954",4.24,309,30,3.0,English,512 pages,Hardcover,Published September 6th 2005 by Knopf Publishing Group (first published 2005),Art,Hilary Spurling
982,How to Draw Cool Stuff: A Drawing Guide for Teachers and Students,4.12,1139,73,,,255 pages,Kindle Edition,Published July 27th 2017 by Library Tales Publishing (first published April 16th 2014),Art,Catherine V. Holmes
983,Marcel Duchamp: The Afternoon Interviews,4.26,502,35,,English,102 pages,Paperback,Published February 28th 2013 by Badlands Unlimited,Art,Calvin Tomkins
984,The Art of Rise of the Guardians,4.56,1717,48,,English,158 pages,Hardcover,Published October 23rd 2012 by Insight Editions (first published October 22nd 2012),Art,Ramin Zahed
985,Artful,4.06,3084,401,2.0,English,256 pages,Hardcover,Published January 24th 2013 by Penguin Press (first published November 1st 2012),Nonfiction,Ali Smith
986,Chuck Close: Face Book,3.96,805,150,2.0,English,64 pages,Hardcover,Published April 1st 2012 by Harry N. Abrams,Biography,Chuck Close
987,The Art Museum,4.32,208,16,,English,992 pages,Hardcover,Published October 17th 2011 by Phaidon Press,Art,Phaidon Press
988,"Brave Intuitive Painting-Let Go, Be Bold, Unfold!: Techniques for Uncovering Your Own Unique Painting Style",4.21,678,59,,English,128 pages,Paperback,Published May 1st 2012 by Quarry Books (first published January 1st 2012),Art,Flora S. Bowley
989,"Rome: A Cultural, Visual, and Personal History",3.83,1358,156,,English,512 pages,Hardcover,Published November 1st 2011 by Knopf,History,Robert Hughes
990,,,,,,,,,,,
991,"Me, Frida",3.88,569,129,1.0,English,32 pages,Hardcover,Published October 1st 2010 by Harry N. Abrams,Childrens,Amy Novesky
992,Drawn to Life: 20 Golden Years of Disney Master Classes: Volume 2: The Walt Stanchfield Lectures,4.47,963,14,,English,354 pages,Paperback,Published March 1st 2009 by Routledge,Art,Walt Stanchfield
993,"I, Juan de Pareja",3.75,8205,493,2.0,English,192 pages,Paperback,"Published August 1st 1987 by Farrar, Straus and Giroux (BYR) (first published June 1st 1965)",Historical,Elizabeth Borton de Treviño
994,Surrealism,4.00,252,15,,English,95 pages,Paperback,Published July 1st 2004 by Taschen (first published January 1st 2004),Art,Cathrin Klingsöhr-Leroy
995,Art in Renaissance Italy,4.28,436,8,,,576 pages,Paperback,Published December 1st 2005 by Laurence King (first published December 2nd 1996),Art,John T. Paoletti
996,Taking Flight: Inspiration and Techniques to Give Your Creative Spirit Wings,4.06,3806,60,,English,127 pages,Paperback,Published September 2nd 2008 by North Light Books (first published January 1st 2008),Art,Kelly Rae Roberts
997,A History of Illuminated Manuscripts,4.24,497,27,,English,272 pages,Paperback,Published September 26th 1997 by Phaidon Press (first published 1986),Art,Christopher de Hamel
998,The Book of a Hundred Hands,4.18,258,12,,English,192 pages,Paperback,Published June 1st 1971 by Dover Publications (first published 1920),Art,George B. Bridgman
999,Steve Jobs,4.16,1167207,20563,3.0,English,630 pages,Hardcover,Published October 24th 2011 by Simon & Schuster (first published October 1st 2011),Biography,Walter Isaacson
1000,The Diary of a Young Girl,4.18,3422873,36692,1.0,English,283 pages,Mass Market Paperback,Published July 1993 by Bantam (first published June 25th 1947),Classics,Anne Frank
1001,Becoming,4.48,914532,63173,4.0,English,426 pages,Hardcover,Published November 13th 2018 by Crown,Nonfiction,Michelle Obama
1002,"Elon Musk: Tesla, SpaceX, and the Quest for a Fantastic Future",4.20,350290,11630,2.0,English,392 pages,Hardcover,Published May 19th 2015 by Ecco (first published March 3rd 2015),Biography,Ashlee Vance
1003,"Unbroken: A World War II Story of Survival, Resilience and Redemption",4.37,886423,48795,7.0,English,475 pages,Hardcover,Published November 16th 2010 by Random House,Nonfiction,Laura Hillenbrand
1004,Educated,4.47,1281212,94564,10.0,English,352 pages,Hardcover,Published February 20th 2018 by Random House,Nonfiction,Tara Westover
1005,John Adams,4.06,349818,6914,6.0,English,751 pages,Paperback,Published May 22nd 2001 by Simon & Schuster Paperbacks (first published May 1st 2001),History,David McCullough
1006,Alexander Hamilton,4.21,167458,9648,2.0,English,818 pages,Paperback,Published March 29th 2005 by Penguin Books (first published April 26th 2004),History,Ron Chernow
1007,Einstein: His Life and Universe,4.16,168750,4130,1.0,English,675 pages,Hardcover,Published April 10th 2007 by Simon & Schuster,Biography,Walter Isaacson
1008,Einstein: His Life and Universe,4.16,168750,4130,1.0,English,675 pages,Hardcover,Published April 10th 2007 by Simon & Schuster,Biography,Walter Isaacson
1009,Einstein: His Life and Universe,4.16,168750,4130,1.0,English,675 pages,Hardcover,Published April 10th 2007 by Simon & Schuster,Biography,Walter Isaacson
1010,The Immortal Life of Henrietta Lacks,4.10,683874,38499,7.0,English,370 pages,Hardcover,Published February 2nd 2010 by Crown Publishing Group,Nonfiction,Rebecca Skloot
1011,Born a Crime: Stories From a South African Childhood,4.49,596328,50036,4.0,English,289 pages,Hardcover,Published November 15th 2016 by Doubleday Canada,Nonfiction,Trevor Noah
1012,Bossypants,3.96,956156,41202,3.0,English,283 pages,Kindle Edition,Published April 5th 2011 by Reagan Arthur Books,Nonfiction,Tina Fey
1013,Into the Wild,4.00,1024136,25776,1.0,English,203 pages,Paperback,Published January 20th 1997 by Anchor Books (first published January 13th 1996),Nonfiction,Jon Krakauer
1014,The Autobiography of Malcolm X,4.35,250509,8258,1.0,English,527 pages,Mass Market Paperback,Published 2015 by Ballantine Books (first published October 29th 1965),Nonfiction,Malcolm X
1015,I Am Malala: The Story of the Girl Who Stood Up for Education and Was Shot by the Taliban,4.15,532248,24140,3.0,English,327 pages,Hardcover,"Published October 8th 2013 by Little, Brown and Company (first published November 1st 2012)",Nonfiction,Malala Yousafzai
1016,Leonardo da Vinci,4.19,92951,5291,2.0,English,600 pages,Hardcover,Published October 17th 2017 by Simon & Schuster,Biography,Walter Isaacson
1017,Benjamin Franklin: An American Life,4.03,132888,2560,,English,586 pages,Paperback,Published June 2004 by Simon & Schuster (first published July 1st 2003),Biography,Walter Isaacson
1018,"""Surely You're Joking, Mr. Feynman!"": Adventures of a Curious Character",4.27,188193,7209,,,400 pages,Paperback,Published February 6th 2018 by W. W. Norton Company (first published 1985),Science,Richard P. Feynman
1019,Night,4.36,1149165,34349,,English,115 pages,Paperback,Published January 16th 2006 by Hill & Wang (first published 1956),Nonfiction,Elie Wiesel
1020,When Breath Becomes Air,4.39,570965,43537,6.0,English,208 pages,Kindle Edition,Published January 12th 2016 by Random House,Nonfiction,Paul Kalanithi
1021,Shoe Dog: A Memoir by the Creator of Nike,4.47,243332,15204,1.0,English,400 pages,Hardcover,Published April 26th 2016 by Scribner (first published April 24th 2016),Business,Phil Knight
1022,I Know Why the Caged Bird Sings,4.28,492603,14356,1.0,English,289 pages,Paperback,Published November 1993 by Bantam Books (first published 1969),Nonfiction,Maya Angelou
1023,Team of Rivals: The Political Genius of Abraham Lincoln,4.27,177859,7843,4.0,English,916 pages,Paperback,Published September 26th 2006 by Simon & Schuster (first published October 25th 2005),History,Doris Kearns Goodwin
1024,A Promised Land,4.35,192600,18288,3.0,English,768 pages,Kindle Edition,Published November 17th 2020 by Crown,Nonfiction,Barack Obama
1025,The Glass Castle,4.30,1094419,57632,2.0,English,288 pages,Paperback,Published January 17th 2006 by Scribner (first published March 1st 2005),Nonfiction,Jeannette Walls
1026,Washington: A Life,4.13,67801,2856,1.0,English,904 pages,Hardcover,Published October 5th 2010 by Penguin Press (first published January 5th 2010),Biography,Ron Chernow
1027,Cleopatra: A Life,3.72,112962,5605,2.0,English,369 pages,Hardcover,"Published November 1st 2010 by Little, Brown and Company",History,Stacy Schiff
1028,Yes Please,3.84,495446,27076,4.0,English,329 pages,Hardcover,Published October 28th 2014 by Dey St.,Nonfiction,Amy Poehler
1029,The Autobiography of Benjamin Franklin,3.85,80461,3497,,English,143 pages,Paperback,Published January 6th 2004 by Touchstone (first published 1791),Biography,Benjamin Franklin
1030,"Bonhoeffer: Pastor, Martyr, Prophet, Spy",4.21,69548,4359,3.0,English,608 pages,Hardcover,Published April 18th 2010 by Thomas Nelson,Biography,Eric Metaxas
1031,Catherine the Great: Portrait of a Woman,3.93,102119,4366,3.0,English,654 pages,Hardcover,"Published November 8th 2011 by Random House, Inc. (NY)",History,Robert K. Massie
1032,The Rise of Theodore Roosevelt,4.21,52311,2050,2.0,English,816 pages,Paperback,Published November 20th 2001 by The Modern Library (first published March 30th 1979),Biography,Edmund Morris
1033,Angela's Ashes,4.14,602346,13396,6.0,English,452 pages,Paperback,Published October 3rd 2005 by Harper Perennial (first published September 5th 1996),Nonfiction,Frank McCourt
1034,Long Walk to Freedom,4.34,81143,4532,1.0,English,656 pages,Paperback,Published October 1st 1995 by Back Bay Books (first published 1994),Biography,Nelson Mandela
1035,The Hiding Place: The Triumphant True Story of Corrie Ten Boom,4.45,300387,12296,,English,242 pages,Paperback,Published October 1st 1984 by Bantam (first published January 1st 1971),Nonfiction,Corrie ten Boom
1036,"Titan: The Life of John D. Rockefeller, Sr.",4.16,28210,1514,1.0,English,832 pages,Paperback,Published March 30th 2004 by Vintage (first published May 5th 1998),Biography,Ron Chernow
1037,Wild: From Lost to Found on the Pacific Crest Trail,4.04,733420,44250,4.0,English,315 pages,Hardcover,Published March 20th 2012 by Knopf,Nonfiction,Cheryl Strayed
1038,Dreams from My Father: A Story of Race and Inheritance,3.92,218728,8450,2.0,English,453 pages,Paperback,Published 2004 by New York: Three Rivers Press (first published July 1995),Nonfiction,Barack Obama
1039,The Wright Brothers,4.15,87246,6743,2.0,English,320 pages,Hardcover,Published May 5th 2015 by Simon & Schuster (first published March 20th 2015),History,David McCullough
1040,Hillbilly Elegy: A Memoir of a Family and Culture in Crisis,3.88,386413,32677,5.0,English,264 pages,Hardcover,Published June 28th 2016 by Harper,Nonfiction,J.D. Vance
1041,Man's Search for Meaning,4.37,600823,32905,,English,165 pages,Paperback,Published June 1st 2006 by Beacon Press (first published 1946),Nonfiction,Viktor E. Frankl
1042,Grant,4.47,32437,3701,7.0,English,1074 pages,Hardcover,Published October 10th 2017 by Penguin Press,History,Ron Chernow
1043,Narrative of the Life of Frederick Douglass,4.09,114117,5939,,English,158 pages,Paperback,Published September 1st 2004 by Ingram (first published 1845),Nonfiction,Frederick Douglass
1044,Notorious RBG: The Life and Times of Ruth Bader Ginsburg,4.19,56600,6070,1.0,English,240 pages,Hardcover,Published October 27th 2015 by Dey Street Books,Nonfiction,Irin Carmon
1045,"Eat, Pray, Love",3.61,1660424,56567,1.0,English,368 pages,Paperback,Published February 1st 2007 by Riverhead Books (first published February 16th 2006),Nonfiction,Elizabeth Gilbert
1046,Tuesdays with Morrie,4.15,935267,34000,,English,210 pages,Paperback,Published 2000 by Warner (first published August 18th 1997),Nonfiction,Mitch Albom
1047,Thomas Jefferson: The Art of Power,4.02,37825,2198,3.0,English,802 pages,Kindle Edition,Published November 13th 2012 by Random House,Biography,Jon Meacham
1048,Kitchen Confidential: Adventures in the Culinary Underbelly,4.13,279783,15257,,English,312 pages,Paperback,Published January 9th 2007 by Ecco/Harper Perennial (first published 2000),Nonfiction,Anthony Bourdain
1049,Just Kids,4.19,237682,16015,6.0,English,304 pages,Hardcover,Published January 19th 2010 by Ecco,Nonfiction,Patti Smith
