,title,rating,num_ratings,num_reviews,num_awards,language,num_page,cover_type,published_year,genre,author
451,"One Zentangle A Day: A 6-Week Course in Creative Drawing for Relaxation, Inspiration, and Fun",4.14,1666,94,,English,128 pages,Paperback,Published November 1st 2012 by Quarry Books (first published January 1st 2012),Art,Beckah Krahula
452,Bird by Bird: Some Instructions on Writing and Life,4.23,93926,9221,,English,237 pages,Paperback,Published October 1st 1995 by Anchor (first published May 5th 1994),Language,Anne Lamott
453,The Painted Kiss,3.78,4241,329,,English,288 pages,Paperback,Published March 7th 2006 by Washington Square Press (first published 2005),Historical,Elizabeth Hickey
454,"Pocket Full of Colors: The Magical World of Mary Blair, Disney Artist Extraordinaire",4.37,1168,250,1.0,English,48 pages,Hardcover,Published August 29th 2017 by Atheneum Books for Young Readers,Childrens,Amy Guglielmo
455,The Art of Pixar,4.37,1439,33,,English,320 pages,Hardcover,Published November 2nd 2011 by Chronicle Books (first published October 1st 2011),Art,Amid Amidi
456,Dictionary of Subjects and Symbols in Art,4.27,215,15,,English,384 pages,Paperback,Published September 4th 1979 by Westview Press (first published November 30th 1973),Art,James Hall
457,Dynamic Anatomy,4.25,1136,17,,English,255 pages,Paperback,Published May 1st 2003 by Watson-Guptill (first published October 1st 1980),Art,Burne Hogarth
458,"Creative Block: Get Unstuck, Discover New Ideas. Advice Projects from 50 Successful Artists",3.95,537,47,,English,288 pages,Paperback,Published February 18th 2014 by Chronicle Books (first published January 1st 2014),Art,Danielle Krysa
459,Artificial Hells: Participatory Art and the Politics of Spectatorship,4.16,483,22,,English,390 pages,Paperback,Published July 24th 2012 by Verso,Art,Claire Bishop
460,The Society of the Spectacle,4.02,18713,861,,English,160 pages,Paperback,Published 1995 by Zone Books (first published 1967),Philosophy,Guy Debord
461,Art History: A Very Short Introduction,3.44,637,66,,English,125 pages,Paperback,"Published April 8th 2004 by Oxford University Press, USA (first published January 1st 2004)",Art,Dana Arnold
462,Darkwerks: The Art of Brom,4.08,5189,25,,English,128 pages,Paperback,Published December 31st 2000 by Paper Tiger (first published January 1st 1997),Art,Brom
463,Spilling Open: The Art of Becoming Yourself,4.03,4896,99,,English,176 pages,Paperback,Published August 15th 2000 by Villard Books,Art,Sabrina Ward Harrison
464,The Gryphon: In Which the Extraordinary Correspondence of Griffin & Sabine Is Rediscovered,4.16,4425,188,,English,58 pages,Hardcover,Published August 1st 2001 by Chronicle Books (first published 2001),Fiction,Nick Bantock
465,The Secret Lives of Men and Women: A PostSecret Book,4.36,5715,246,,English,144 pages,Hardcover,Published January 9th 2007 by William Morrow,Nonfiction,Frank Warren
466,I Was Vermeer: The Rise and Fall of the Twentieth Century's Greatest Forger,3.89,1423,120,,English,288 pages,Hardcover,Published September 1st 2006 by Bloomsbury USA,Art,Frank Wynne
467,The Artist's Reality: Philosophies of Art,3.88,417,39,,English,176 pages,Paperback,Published March 23rd 2006 by Yale University Press (first published September 2004),Art,Mark Rothko
468,The Rest Is Noise: Listening to the Twentieth Century,4.09,14588,838,8.0,English,640 pages,Hardcover,"Published October 16th 2007 by Farrar, Straus and Giroux (first published 2007)",Music,Alex Ross
469,The Art of Walt Disney: From Mickey Mouse to the Magic Kingdoms,4.13,2420,94,,English,504 pages,Hardcover,Published November 1st 2004 by Harry N. Abrams (first published 1973),Art,Christopher Finch
470,Aesthetic Theory,4.13,2422,49,,English,416 pages,Paperback,Published August 12th 1998 by Univ Of Minnesota Press (first published 1970),Philosophy,Theodor W. Adorno
471,The Complete Untitled Film Stills,4.08,4513,28,,English,164 pages,Hardcover,Published October 2nd 2003 by Museum of Modern Art (first published 1990),Art,Cindy Sherman
472,Pictures & Tears: A History of People Who Have Cried in Front of Paintings,3.90,341,54,,English,272 pages,Paperback,Published February 23rd 2004 by Routledge (first published January 1st 2001),Art,James Elkins
473,On Art and Life,3.85,937,69,,English,98 pages,Paperback,Published September 6th 2005 by Penguin Books (first published 1853),Art,John Ruskin
474,"Gustav Klimt, 1862–1918: The World in Female Form",4.36,1322,15,,English,239 pages,Hardcover,Published June 1st 2006 by Taschen (first published 1990),Art,Gottfried Fliedl
475,J.W. Waterhouse,4.23,1760,15,,English,128 pages,Paperback,Published January 1st 1994 by Phaidon Press (first published 1980),Art,Anthony Hobson
476,Barlowe's Guide to Extraterrestrials: Great Aliens from Science Fiction Literature,4.13,1111,53,2.0,English,144 pages,Paperback,Published January 11th 1987 by Workman Publishing Company (first published October 1979),Science Fiction,Wayne Barlowe
477,Utopia Parkway: The Life and Work of Joseph Cornell,4.08,1758,66,,English,448 pages,Paperback,Published November 2nd 2004 by MFA Publications,Art,Deborah Solomon
478,Ain't Burned All the Bright,4.47,11185,2100,,English,384 pages,Hardcover,Published January 11th 2022 by Atheneum/Caitlyn Dlouhy Books,Poetry,Jason Reynolds
479,Joan Miro: 1893-1983,4.24,773,19,,English,96 pages,Paperback,Published August 1st 1999 by Taschen (first published 1993),Art,Janis Mink
480,Dare to Sketch: A Guide to Drawing on the Go,4.10,672,96,,,160 pages,Hardcover,Published September 19th 2017 by Watson-Guptill,Art,Felix Scheinberger
481,Relational Aesthetics,3.71,1110,44,,English,128 pages,Paperback,Published 2002 by les presses du réel (first published 1998),Art,Nicolas Bourriaud
482,Georgia: A Novel of Georgia O'Keeffe,3.86,5317,835,,English,336 pages,Hardcover,Published February 9th 2016 by Random House,Historical,Dawn Tripp
483,The Resurrectionist: The Lost Work of Dr. Spencer Black,3.59,5782,877,1.0,English,208 pages,Hardcover,Published May 21st 2013 by Quirk Books,Horror,E.B. Hudspeth
484,How Music Works,3.99,22603,1384,,English,345 pages,Hardcover,Published September 12th 2012 by McSweeney's,Music,David Byrne
485,Art,4.13,1243,151,,English,48 pages,Hardcover,"Published April 12th 2006 by Little, Brown Books for Young Readers",Childrens,Patrick McDonnell
486,Daybook: The Journal of an Artist,4.18,865,82,,English,240 pages,Paperback,Published March 6th 1984 by Penguin Books (first published September 12th 1982),Art,Anne Truitt
487,"History of Italian Renaissance Art: Painting, Sculpture, Architecture",4.21,1194,26,,English,704 pages,Hardcover,Published March 1st 1987 by Prentice Hall (first published January 1969),Art,Frederick Hartt
488,Art Theory: A Very Short Introduction,3.60,482,44,,,184 pages,Paperback,Published 2007 by Oxford University Press (first published 2003),Art,Cynthia A. Freeland
489,Amano: The Complete Prints,4.21,2073,18,,English,292 pages,Paperback,Published November 4th 2003 by Harper Design (first published November 1st 2003),Art,Yoshitaka Amano
490,Time,4.40,1107,26,,English,206 pages,Hardcover,Published November 1st 2000 by Harry N. Abrams (first published August 2000),Art,Andy Goldsworthy
491,Reinventing Comics: How Imagination And Technology Are Revolutionizing An Art Form,3.89,3592,192,,English,256 pages,Paperback,Published August 1st 2000 by William Morrow Paperbacks (first published January 1st 2000),Sequential Art,Scott McCloud
492,Alice's Adventures in Wonderland,4.00,345309,15182,,English,320 pages,Hardcover,Published by Pan Macmillan (first published 1865),Classics,Lewis Carroll
493,What If...,4.43,1670,375,1.0,English,34 pages,Hardcover,"Published April 10th 2018 by Little, Brown Books for Young Readers",Childrens,Samantha Berger
494,A History of Pictures: From the Cave to the Computer Screen,4.40,567,71,,English,360 pages,Hardcover,Published October 18th 2016 by Harry N. Abrams (first published 2016),Art,David Hockney
495,My Pen,4.02,1281,267,1.0,English,32 pages,Hardcover,"Published March 10th 2015 by Little, Brown Books for Young Readers (first published March 1st 2015)",Childrens,Christopher Myers
496,Perspective! for Comic Book Artists: How to Achieve a Professional Look in your Artwork,4.05,3502,43,,English,176 pages,Paperback,Published October 1st 1997 by Watson-Guptill,Art,David Chelsea
497,The Art of Star Wars: The Force Awakens,4.46,1724,172,,English,256 pages,Hardcover,Published December 18th 2015 by Harry N. Abrams,Media Tie In,Phil Szostak
498,Funny Bones: Posada and His Day of the Dead Calaveras,4.09,2233,526,7.0,English,40 pages,Hardcover,Published August 25th 2015 by Harry N. Abrams,Childrens,Duncan Tonatiuh
499,Draw!,3.95,1528,325,1.0,English,40 pages,Hardcover,Published September 16th 2014 by Simon & Schuster Books for Young Readers (first published January 1st 2014),Childrens,Raúl Colón
500,The Polaroid Book: Selections from the Polaroid Collections of Photography,4.08,2641,61,,English,351 pages,Hardcover,Published April 1st 2008 by Taschen (first published February 25th 2005),Art,Steve Crist
501,Alphonse Mucha: The Spirit of Art Nouveau,4.30,843,17,,English,344 pages,Hardcover,Published April 20th 1998 by Yale University Press (first published 1986),Art,Victor Arwas
502,"Renoir, My Father",4.06,740,77,,English,437 pages,Paperback,Published September 30th 2001 by NYRB Classics (first published 1958),Art,Jean Renoir
503,Keeping a Nature Journal: Discover a Whole New Way of Seeing the World Around You,4.26,1035,90,,English,213 pages,Paperback,"Published July 5th 2003 by Storey Publishing, LLC (first published January 1st 2000)",Environment,Clare Walker Leslie
504,"Drawing with Children: A Creative Method for Adult Beginners, Too",4.08,864,63,,English,304 pages,Paperback,Published June 4th 1996 by Tarcherperigee (first published 1986),Art,Mona Brookes
505,Why Have There Been No Great Women Artists?,4.36,820,89,,English,34 pages,Paperback,Published 1971 by ARTnews,Art,Linda Nochlin
506,M Train,4.00,38099,3766,4.0,English,256 pages,Hardcover,Published October 6th 2015 by Knopf,Nonfiction,Patti Smith
507,Contemporary Art: A Very Short Introduction,3.44,349,43,,English,168 pages,Paperback,"Published May 25th 2006 by Oxford University Press, USA (first published January 1st 2006)",Art,Julian Stallabrass
508,Artist to Artist: 23 Major Illustrators Talk to Children about Their Art,4.23,844,94,,English,105 pages,Hardcover,Published September 25th 2007 by Philomel Books,Art,Eric Carle
509,Picasso,3.73,1494,144,,English,144 pages,Paperback,Published September 1st 1984 by Dover Publications (first published 1938),Art,Gertrude Stein
510,Songs of Innocence and of Experience,4.10,45810,1213,,English,56 pages,Paperback,Published January 1st 2005 by Digireads.com (first published 1794),Poetry,William Blake
511,"Alfons Mucha, 1860-1939: Master of Art Nouveau",4.19,418,29,,English,96 pages,Paperback,Published April 1st 1997 by Taschen (first published 1993),Art,Renate Ulmer
512,The Unknown Masterpiece,3.84,4775,389,,English,160 pages,Paperback,Published August 31st 2000 by NYRB Classics (first published August 1831),Fiction,Honoré de Balzac
513,Louise Loves Art,4.03,1056,174,,English,48 pages,Hardcover,Published September 9th 2014 by Balzer + Bray,Childrens,Kelly Light
514,The Art of The Hobbit by J.R.R. Tolkien,4.31,6086,104,2.0,English,144 pages,Hardcover,Published October 27th 2011 by HarperCollins Publishers,Fantasy,Wayne G. Hammond
515,Water Paper Paint: Exploring Creativity with Watercolor and Mixed Media,4.08,741,44,,English,156 pages,Paperback,Published January 1st 2011 by Quarry Books,Art,Heather Smith Jones
516,Oil Painting Techniques and Materials,4.24,508,16,,,280 pages,Paperback,Published December 1st 1987 by Dover Publications,Art,Harold Speed
517,Ignore Everybody: and 39 Other Keys to Creativity,4.03,23174,581,,English,159 pages,Hardcover,Published June 11th 2009 by Portfolio (first published 2009),Nonfiction,Hugh MacLeod
518,The Book of Tea,3.86,13220,1492,,English,133 pages,Hardcover,Published 1989 by Tuttle (first published 1906),Nonfiction,Kakuzō Okakura
519,Lizzie Siddal: The Tragedy of a Pre-Raphaelite Supermodel,4.00,931,110,,English,256 pages,Unknown Binding,Published November 28th 2005 by Not Avail (first published 2004),Biography,Lucinda Hawksley
520,POPism: The Warhol Sixties,4.09,2060,121,,English,416 pages,Paperback,Published September 5th 2006 by Mariner Books (first published 1980),Art,Andy Warhol
521,"The Art of Animal Drawing: Construction, Action Analysis, Caricature",4.21,1454,14,,English,144 pages,Paperback,Published February 9th 1993 by Dover Publications,Art,Ken Hultgren
522,The Arthur Rackham Treasury: 86 Full-Color Illustrations,4.33,807,26,,English,96 pages,Paperback,Published August 15th 2005 by Dover Publications,Art,Jeff A. Menges
523,Women Artists and the Surrealist Movement,4.35,469,10,,English,256 pages,Paperback,Published May 17th 1991 by Thames Hudson (first published January 1st 1985),Art,Whitney Chadwick
524,The Visual Display of Quantitative Information,4.39,8017,565,,English,197 pages,Hardcover,Published 2001 by Graphics Press (first published 1983),Design,Edward R. Tufte
525,The Photograph as Contemporary Art,3.95,3393,55,,English,224 pages,Paperback,Published March 28th 2005 by Thames & Hudson (first published November 1st 2004),Art,Charlotte Cotton
526,Introductory Lectures on Aesthetics,3.86,1133,56,,English,197 pages,Paperback,Published April 1st 2004 by Penguin Books Ltd (first published 1835),Philosophy,Georg Wilhelm Friedrich Hegel
527,Hilma af Klint: Paintings for the Future,4.53,250,19,,English,244 pages,Hardcover,Published October 23rd 2018 by Guggenheim Museum,Art,Hilma af Klint
528,Bibliophile: An Illustrated Miscellany,4.33,4746,957,,English,224 pages,Hardcover,Published 2018 by Chronicle Books,Nonfiction,Jane Mount
529,The Art of Tim Burton,4.65,971,53,,English,434 pages,Hardcover,Published 2009 by Steeles Publishing (first published September 1st 1999),Art,Tim Burton
530,And the Pursuit of Happiness,4.30,6501,350,,English,471 pages,Hardcover,Published October 14th 2010 by Penguin Press,Art,Maira Kalman
531,Classical Art: From Greece to Rome,4.09,281,15,,English,298 pages,Paperback,"Published July 19th 2001 by Oxford University Press, USA",Art,Mary Beard
532,Charles Bargue and Jean-Leon Gerome: Drawing Course,4.57,342,14,,English,336 pages,Hardcover,Published October 31st 2007 by Art Creation Realisation (first published October 31st 2003),Art,Gerald M. Ackerman
533,www HR Giger com,4.18,1238,13,,English,240 pages,Hardcover,Published January 1st 2007 by Taschen (first published 1997),Art,H.R. Giger
534,Artemisia,3.93,5474,167,1.0,English,427 pages,Paperback,Published September 21st 2001 by Grove Press (first published March 22nd 1999),Historical,Alexandra Lapierre
535,Transfigurations,4.24,3044,19,1.0,English,176 pages,Paperback,Published November 9th 2004 by Inner Traditions (first published 2001),Art,Alex Grey
536,Imagine!,3.96,751,186,,English,40 pages,Hardcover,Published September 11th 2018 by Simon Schuster Books for Young Readers,Childrens,Raúl Colón
537,Meetings with Remarkable Manuscripts,4.43,1245,249,4.0,English,632 pages,Hardcover,Published September 22nd 2016 by Allen Lane,History,Christopher de Hamel
538,Hiroshige,4.15,431,24,,English,96 pages,Paperback,Published October 1st 2007 by Taschen (first published January 1st 2007),Art,Adele Schlombs
539,"The Decorated Page: Journals, Scrapbooks Albums Made Simply Beautiful",4.11,4890,47,,English,128 pages,Paperback,Published August 1st 2003 by Lark Books (first published October 28th 2002),Art,Gwen Diehn
540,Men to Avoid in Art and Life,3.95,1680,412,,,96 pages,Hardcover,Published August 11th 2020 by Chronicle Books,Humor,Nicole Tersigni
541,The Art of Frozen,4.40,2531,135,,English,160 pages,Hardcover,Published December 3rd 2013 by Chronicle Books (first published November 1st 2013),Art,Charles Solomon
542,Black: The History of a Color,4.09,610,62,,English,211 pages,Hardcover,Published November 16th 2008 by Princeton University Press (first published October 2008),Art,Michel Pastoureau
543,Camille and the Sunflowers: A Story About Vincent van Gogh,4.11,760,97,,English,32 pages,Hardcover,Published August 1st 1994 by Sourcebooks Explore,Art,Laurence Anholt
544,Subway Art,4.18,2315,54,,English,104 pages,Paperback,Published September 15th 1988 by Holt McDougal (first published January 1st 1984),Art,Martha Cooper
545,Alexandria: In Which the Extraordinary Correspondence of Griffin & Sabine Unfolds,4.16,2670,113,,English,58 pages,Hardcover,Published September 1st 2002 by Chronicle Books,Fiction,Nick Bantock
546,"Think Like an Artist: and Lead a More Creative, Productive Life",3.87,1772,194,,,208 pages,Hardcover,Published April 12th 2016 by Harry N. Abrams (first published May 2015),Art,Will Gompertz
547,"Boom: Mad Money, Mega Dealers, and the Rise of Contemporary Art",3.88,694,79,,,464 pages,Hardcover,Published May 21st 2019 by PublicAffairs,Art,Michael Shnayerson
548,"Leonardo Da Vinci, 1452-1519",4.34,752,21,,English,96 pages,Paperback,Published May 1st 2000 by Taschen,Art,Frank Zöllner
549,The Fantastic Jungles of Henri Rousseau,4.17,676,116,1.0,English,34 pages,Hardcover,Published September 1st 2012 by Eerdmans Books,Childrens,Michelle Markel
550,Man with a Blue Scarf: On Sitting for a Portrait by Lucian Freud,4.36,814,85,,English,256 pages,Hardcover,Published October 15th 2010 by Thames Hudson (first published 2010),Art,Martin Gayford
551,The Madonnas of Leningrad,3.78,17493,2266,,English,228 pages,Paperback,Published February 20th 2007 by Harper Perennial (first published 2006),Historical,Debra Dean
552,"Rendering in Pen and Ink: The Classic Book on Pen and Ink Techniques for Artists, Illustrators, Architects, and Designers",4.23,515,26,,English,256 pages,Paperback,Published August 1st 1997 by Watson-Guptill (first published September 1st 1976),Art,Arthur L. Guptill
553,Rothko,4.16,671,29,,English,96 pages,Paperback,Published 2003 by Taschen,Art,Jacob Baal-Teshuva
554,"Hey, Kiddo: How I Lost My Mother, Found My Father, and Dealt with Family Addiction",4.14,30669,3473,11.0,English,320 pages,Paperback,Published October 9th 2018 by Graphix,Sequential Art,Jarrett J. Krosoczka
555,"Artcurious: Stories of the Unexpected, Slightly Odd, and Strangely Wonderful in Art History",3.88,1088,163,,English,288 pages,Paperback,Published September 15th 2020 by Penguin Books,Nonfiction,Jennifer Dasal
556,Women in Art: 50 Fearless Creatives Who Inspired the World,4.36,672,111,,,128 pages,Hardcover,Published September 10th 2019 by Ten Speed Press,Nonfiction,Rachel Ignotofsky
557,Making Comics,4.44,873,159,,English,200 pages,Paperback,Published November 5th 2019 by Drawn and Quarterly (first published May 2019),Art,Lynda Barry
558,Autumn,3.69,67910,6228,2.0,English,264 pages,Hardcover,Published October 20th 2016 by Hamish Hamilton,Fiction,Ali Smith
559,Caravaggio: The Complete Works,4.62,330,32,,English,306 pages,Hardcover,Published December 1st 2009 by Taschen (first published 2009),Art,Sebastian Schütze
560,"The Social History of Art, Volume 1: From Prehistoric Times to the Middle Ages",4.13,259,21,,English,360 pages,Paperback,Published December 31st 1990 by Routledge (first published 1951),Art,Arnold Hauser
561,Graffiti Moon,3.88,19826,2099,6.0,English,264 pages,Paperback,Published August 1st 2010 by Pan Macmillan Australia,Young Adult,Cath Crowley
562,,,,,,,,,,,
563,Annie Leibovitz at Work,4.11,5278,261,,English,240 pages,Hardcover,Published November 18th 2008 by Random House (first published January 1st 2008),Art,Annie Leibovitz
564,How Art Made the World,4.09,247,13,,English,288 pages,Paperback,Published November 27th 2006 by Basic Books (first published April 28th 2005),Art,Nigel Spivey
565,American Visions: The Epic History of Art in America,4.27,531,38,1.0,English,648 pages,Hardcover,Published April 22nd 1997 by Knopf (first published January 1st 1997),Art,Robert Hughes
566,Drawing the Human Head,4.21,1339,21,,English,160 pages,Paperback,Published February 1st 1989 by Watson-Guptill (first published 1965),Art,Burne Hogarth
567,"The Conspiracy of Art: Manifestos, Interviews, Essays",3.93,713,29,,English,248 pages,Paperback,Published August 19th 2005 by Semiotext(e) (first published 1999),Art,Jean Baudrillard
568,The Improbability of Love,3.68,14470,1841,2.0,English,408 pages,Hardcover,Published November 3rd 2015 by Knopf (first published April 22nd 2015),Fiction,Hannah Rothschild
569,Myth and Magic: The Art of John Howe,4.38,528,35,,English,141 pages,Hardcover,Published December 1st 2001 by HarperCollins UK (first published January 1st 2001),Art,John Howe
570,"PostSecret: Confessions on Life, Death, and God",4.35,4858,258,,English,276 pages,Hardcover,Published October 6th 2009 by William Morrow,Nonfiction,Frank Warren
571,The Civilization of the Renaissance in Italy,3.93,2952,122,,English,400 pages,Paperback,Published June 28th 1990 by Penguin Classics (first published 1860),History,Jacob Burckhardt
572,The Complete Maus,4.56,192730,12014,2.0,English,296 pages,Paperback,Published October 2nd 2003 by Penguin Books (first published 1980),Sequential Art,Art Spiegelman
573,Mastering Composition: Techniques and Principles to Dramatically Improve Your Painting,4.36,328,36,,English,144 pages,Hardcover,Published November 29th 2007 by North Light Books,Art,Ian Roberts
574,Art: A New History,3.94,278,36,,English,777 pages,Hardcover,Published September 30th 2003 by Harper (first published August 14th 2003),Art,Paul Johnson
575,Immediate Family,4.20,5822,53,,English,78 pages,Paperback,Published May 2nd 2001 by Phaidon Press (first published 1992),Art,Sally Mann
576,Art and Culture: Critical Essays,3.89,531,23,,English,288 pages,Paperback,Published June 1st 1971 by Beacon Press,Art,Clement Greenberg
577,"Women, Art, and Power and Other Essays",4.25,323,20,,English,208 pages,Paperback,Published October 20th 1989 by Westview Press (first published 1988),Art,Linda Nochlin
578,Brian Froud's World of Faerie,4.45,2121,38,,English,168 pages,Hardcover,Published August 24th 2007 by Insight Editions,Fantasy,Brian Froud
579,The Country Diary of an Edwardian Lady,4.29,1999,246,,English,176 pages,Hardcover,Published May 1st 2006 by Top That! Publishing (first published August 1977),Nonfiction,Edith Holden
580,A Perfect Red,3.88,2887,251,1.0,English,352 pages,Paperback,Published April 25th 2006 by Harper Perennial (first published 2005),History,Amy Butler Greenfield
581,"How to See: Looking, Talking, and Thinking about Art",3.56,378,48,,English,288 pages,Hardcover,Published October 18th 2016 by W. W. Norton Company,Art,David Salle
582,Freehand: Sketching Tips and Tricks Drawn from Art,3.84,403,57,,English,224 pages,Paperback,Published September 10th 2013 by Chronicle Books,Art,Helen Birch
583,"Pablo Picasso, 1881-1973: Genius of the Century",4.24,768,29,,English,96 pages,Paperback,Published May 17th 2000 by Taschen (first published August 3rd 1990),Art,Ingo F. Walther
584,Maus I: A Survivor's Tale: My Father Bleeds History,4.37,304841,8654,4.0,English,159 pages,Hardcover,Published November 1st 1991 by Pantheon Books (first published August 12th 1986),Sequential Art,Art Spiegelman
585,Art Objects: Essays on Ecstasy and Effrontery,4.07,2235,162,,English,192 pages,Paperback,Published February 4th 1997 by Vintage (first published 1995),Nonfiction,Jeanette Winterson
586,Sister Wendy's 1000 Masterpieces,4.27,714,39,,,,,,Art,Wendy Beckett
587,Charley Harper: An Illustrated Life,4.45,1185,71,,English,421 pages,Hardcover,Published June 1st 2007 by Ammo Books (first published 2007),Art,Todd Oldham
588,What Painting Is,4.10,487,38,,English,256 pages,Paperback,Published March 31st 2000 by Routledge (first published 1998),Art,James Elkins
589,Art of the Twentieth Century,4.25,250,8,,English,840 pages,Hardcover,Published December 1st 2000 by Taschen (first published 1998),Art,Ingo F. Walther
590,Reductionism in Art and Brain Science: Bridging the Two Cultures,4.15,673,85,,English,,ebook,Published August 30th 2016 by Columbia University Press,Art,Eric R. Kandel
591,Adulthood Is a Myth,4.12,121548,7643,1.0,English,112 pages,Paperback,Published March 8th 2016 by Andrews McMeel Publishing,Sequential Art,Sarah Andersen
592,"Sketch!: The Non-Artist's Guide to Inspiration, Technique, and Drawing Daily Life",4.02,641,80,,,144 pages,Paperback,Published November 15th 2014 by Watson-Guptill (first published November 4th 2014),Art,France Belleville-Van Stone
593,How to Write About Contemporary Art,4.17,432,38,,,264 pages,Paperback,Published October 14th 2014 by Thames Hudson (first published September 1st 2014),Art,Gilda Williams
594,Lisette's List,3.81,5837,942,,English,433 pages,Kindle Edition,Published August 26th 2014 by Random House (first published 2014),Historical,Susan Vreeland
595,"Cabinet of Curiosities: My Notebooks, Collections, and Other Obsessions",4.54,1350,144,,English,263 pages,Hardcover,Published October 29th 2013 by Harper Design (first published 2013),Nonfiction,Guillermo del Toro
596,The Museum,4.04,841,132,,English,32 pages,Hardcover,Published March 12th 2013 by Harry N. Abrams (first published March 1st 2013),Childrens,Susan Verde
597,Imagine: How Creativity Works,3.92,45234,1758,,English,279 pages,Hardcover,Published March 19th 2012 by Houghton Mifflin Harcourt,Nonfiction,Jonah Lehrer
598,Drawing Down the Moon: The Art of Charles Vess,4.39,620,41,1.0,English,200 pages,Hardcover,Published December 29th 2009 by Dark Horse Books (first published December 2009),Art,Charles Vess
599,La tabla de Flandes,3.79,22882,1200,2.0,Spanish,412 pages,Paperback,Published September 28th 2005 by Debolsillo (first published 1990),Mystery,Arturo Pérez-Reverte
