,title,rating,num_ratings,num_reviews,num_awards,language,num_page,cover_type,published_year,genre,author
204,Secret Knowledge: Rediscovering the Lost Techniques of the Old Masters,4.16,2176.0,103.0,0.0,English,336 pages,Paperback,Published October 5th 2006 by Avery (first published 2001),Art,David Hockney
212,Fun with a Pencil,4.12,2314.0,52.0,0.0,English,121 pages,Paperback,Published May 8th 1939 by Viking Books,Art,Andrew Loomis
296,Dada: Art and Anti-Art,4.26,598.0,40.0,0.0,English,248 pages,Paperback,Published May 17th 1997 by Thames Hudson (first published 1964),Art,Hans Richter
374,"The Value of Art: Money, Power, Beauty",4.03,496.0,35.0,0.0,English,208 pages,Hardcover,Published April 10th 2012 by Prestel (first published January 1st 2012),Art,Michael Findlay
386,Studies in Iconology: Humanistic Themes in the Art of the Renaissance,4.21,982.0,17.0,0.0,English,400 pages,Paperback,Published March 15th 1972 by Westview Press (first published 1967),Art,Erwin Panofsky
392,100 Artists' Manifestos: From the Futurists to the Stuckists,4.1,398.0,23.0,0.0,English,454 pages,Paperback,Published January 27th 2011 by Penguin Classics,Art,Alex Danchev
489,Hiroshige,4.15,431.0,24.0,0.0,English,96 pages,Paperback,Published October 1st 2007 by Taschen (first published January 1st 2007),Art,Adele Schlombs
818,Saddest Place on Earth,4.26,598.0,19.0,0.0,English,100 pages,Paperback,Published February 25th 2015 by Last Gasp (first published June 11th 2005),Art,Camille Rose Garcia
858,Lives of the Artists: Portraits of Ten Artists Whose Work and Lifestyles Embody the Future of Contemporary Art,4.08,555.0,40.0,0.0,English,272 pages,Hardcover,Published October 28th 2008 by Henry Holt and Co.,Art,Calvin Tomkins
1041,Boy: Tales of Childhood,4.07,65354.0,3255.0,0.0,English,176 pages,Paperback,Published April 5th 2001 by Puffin Books (first published 1984),Nonfiction,Roald Dahl
1310,Balloons Over Broadway: The True Story of the Puppeteer of Macy's Parade,4.07,12648.0,1937.0,5.0,English,40 pages,Hardcover,Published November 1st 2011 by Houghton Mifflin Books for Children,Childrens,Melissa Sweet
1500,The Secret Life of Marilyn Monroe,4.06,4869.0,444.0,0.0,English,560 pages,Hardcover,Published August 27th 2009 by Grand Central Publishing (first published 2009),Biography,J. Randy Taraborrelli
1536,Stalin’s Daughter: The Extraordinary and Tumultuous Life of Svetlana Alliluyeva,3.96,4428.0,629.0,5.0,English,741 pages,Hardcover,Published June 2nd 2015 by Harper,Biography,Rosemary Sullivan
1784,"The Autobiography of Charles Darwin, 1809–82",3.83,2631.0,228.0,0.0,English,224 pages,Paperback,Published September 17th 1993 by W.W. Norton & Company (first published 1887),Biography,Charles Darwin
2080,"Launch: An Internet Millionaire's Secret Formula to Sell Almost Anything Online, Build a Business You Love, and Live the Life of Your Dreams",3.98,3857.0,261.0,0.0,English,170 pages,Kindle Edition,Published June 24th 2014 by Morgan James Publishing (first published June 1st 2014),Business,Jeff Walker
2189,Fierce Conversations: Achieving Success at Work and in Life One Conversation at a Time,4.01,8795.0,479.0,0.0,English,336 pages,Paperback,Published May 2nd 2017 by New American Library (first published 2002),Business,Susan Scott
2419,"Rich Dad's Retire Young, Retire Rich: How to Get Rich Quickly and Stay Rich Forever!",4.08,7466.0,240.0,0.0,English,383 pages,Paperback,Published 2002 by Time Warner,Business,Robert T. Kiyosaki
2455,Think Big and Kick Ass in Business and Life,3.85,3459.0,314.0,0.0,English,384 pages,Hardcover,Published October 16th 2007 by Harper Business (first published 2007),Business,Donald J. Trump
2561,Badass: Making Users Awesome,4.21,982.0,127.0,0.0,English,294 pages,Paperback,Published February 23rd 2015 by O'Reilly Media (first published January 1st 2015),Business,Kathy Sierra
2916,Boy: Tales of Childhood,4.07,65352.0,3255.0,0.0,English,176 pages,Paperback,Published April 5th 2001 by Puffin Books (first published 1984),Nonfiction,Roald Dahl
3390,The Undefeated,4.68,6142.0,1455.0,7.0,English,40 pages,Hardcover,Published April 2nd 2019 by Versify,Childrens,Kwame Alexander
3562,The Voyage of the Dawn Treader,4.09,442631.0,9281.0,0.0,English,248 pages,Hardcover,Published September 1st 2006 by HarperCollins (first published September 15th 1952),Fantasy,C.S. Lewis
3624,The Holiness of God,4.39,19811.0,850.0,0.0,English,240 pages,Paperback,Published March 3rd 2020 by Tyndale Momentum (first published November 30th 1984),Religion,R.C. Sproul
3759,God in the Dock: Essays on Theology and Ethics,4.23,8004.0,343.0,0.0,English,346 pages,Paperback,Published March 24th 1972 by William B. Eerdmans Publishing Company (first published July 2nd 1971),Religion,C.S. Lewis
3763,7: An Experimental Mutiny Against Excess,4.08,19339.0,1768.0,0.0,English,240 pages,Paperback,Published January 1st 2012 by B Books (first published December 19th 2011),Nonfiction,Jen Hatmaker
3800,One Tuesday Morning,4.39,19811.0,780.0,1.0,English,352 pages,Paperback,Published May 11th 2003 by Zondervan (first published April 28th 2003),Christian,Karen Kingsbury
3872,Hearing God: Developing a Conversational Relationship with God,4.15,4656.0,361.0,0.0,English,228 pages,Paperback,Published October 1st 1999 by IVP Books (first published 1984),Christian,Dallas Willard
4030,The Case for the Real Jesus: A Journalist Investigates Current Attacks on the Identity of Christ,4.37,3797.0,188.0,0.0,English,311 pages,Hardcover,Published August 19th 2007 by Zondervan Publishing Company,Christian,Lee Strobel
4324,Taken,4.14,5989.0,561.0,0.0,English,424 pages,Hardcover,Published April 28th 2015 by Bethany House Publishers,Christian Fiction,Dee Henderson
4333,The Preacher's Daughter,4.17,8623.0,425.0,0.0,English,350 pages,Paperback,Published November 1st 2005 by Bethany House Publishers (first published 2005),Amish,Beverly Lewis
4345,Unspoken,4.2,6023.0,587.0,0.0,English,448 pages,Paperback,Published October 1st 2013 by Bethany House Publishers,Christian Fiction,Dee Henderson
4389,Blessed Child,4.2,6023.0,306.0,0.0,English,368 pages,Paperback,Published May 21st 2013 by Thomas Nelson (first published April 4th 2001),Christian Fiction,Ted Dekker
4951,An Old-Fashioned Girl,4.08,19339.0,1099.0,0.0,English,288 pages,Paperback,Published October 25th 2005 by Dodo Press (first published 1870),Classics,Louisa May Alcott
5259,Old Possum's Book of Practical Cats,4.07,26410.0,1978.0,0.0,English,56 pages,Hardcover,Published 1982 by Harcourt Brace & Company (first published October 5th 1939),Poetry,T.S. Eliot
5489,"Ultimate Spider-Man, Volume 1: Power and Responsibility",4.15,16971.0,543.0,0.0,English,200 pages,Paperback,Published May 16th 2007 by Marvel (first published 2001),Sequential Art,Brian Michael Bendis
5598,"All-Star Superman, Vol. 2",4.33,14729.0,303.0,1.0,English,154 pages,Hardcover,Published February 17th 2009 by DC Comics (first published January 1st 2009),Sequential Art,Grant Morrison
5793,Green Arrow: Year One,4.06,6892.0,417.0,0.0,English,160 pages,Hardcover,Published April 22nd 2008 by DC Comics (first published 2007),Sequential Art,Andy Diggle
5826,"The Walking Dead, Vol. 21: All Out War Part 2",4.11,8140.0,525.0,0.0,English,136 pages,Comics,Published July 29th 2014 by Image Comics (first published July 23rd 2014),Sequential Art,Robert Kirkman
5921,Asterix and the Black Gold,4.04,5657.0,108.0,0.0,English,48 pages,Paperback,Published November 15th 2001 by Asterix (first published January 1st 1981),Sequential Art,Albert Uderzo
5928,Asterix and the Magic Carpet,3.95,5001.0,117.0,0.0,English,48 pages,Paperback,Published March 21st 2002 by Asterix (first published 1987),Sequential Art,Albert Uderzo
5972,Buffy the Vampire Slayer: Last Gleaming,3.92,5833.0,406.0,1.0,English,168 pages,Paperback,Published June 1st 2011 by Dark Horse Books,Sequential Art,Joss Whedon
5978,X-Men: Second Coming,4.14,5925.0,186.0,0.0,English,392 pages,Hardcover,Published October 13th 2010 by Marvel Comics,Sequential Art,Mike Carey
6051,"Berlin, Vol. 1: City of Stones",3.94,6022.0,358.0,0.0,English,212 pages,Paperback,Published February 2001 by Drawn and Quarterly (first published June 1st 2000),Sequential Art,Jason Lutes
6363,"Anthony Bourdain's Les Halles Cookbook: Strategies, Recipes, and Techniques of Classic Bistro Cooking",4.14,5925.0,148.0,0.0,English,304 pages,Hardcover,Published 2004 by Bloomsbury USA,Food and Drink,Anthony Bourdain
6505,All About Braising: The Art of Uncomplicated Cooking,4.14,1868.0,40.0,0.0,English,481 pages,Hardcover,Published October 17th 2004 by W. W. Norton Company (first published October 2004),Food and Drink,Molly Stevens
6528,Rick Bayless's Mexican Kitchen,4.15,1931.0,33.0,0.0,English,448 pages,Hardcover,Published October 21st 1996 by Scribner,Food and Drink,Rick Bayless
6543,The Little Women Cookbook: Tempting Recipes from the March Sisters and Their Friends and Family,4.1,398.0,128.0,1.0,English,112 pages,Hardcover,Published October 1st 2019 by Harvard Common Press,Food and Drink,Wini Moranville
6574,La Dolce Vegan!: Vegan Livin' Made Easy,3.85,3459.0,60.0,0.0,English,334 pages,Paperback,Published October 1st 2005 by Arsenal Pulp Press,Food and Drink,Sarah Kramer
6597,Giada at Home: Family Recipes from Italy and California,4.16,2176.0,42.0,0.0,English,240 pages,Hardcover,Published March 30th 2010 by Clarkson Potter (first published 2010),Food and Drink,Giada De Laurentiis
6621,"The Geeky Chef Cookbook: Real-Life Recipes for Your Favorite Fantasy Foods - Unofficial Recipes from Doctor Who, Game of Thrones, Harry Potter, and more",4.08,555.0,127.0,0.0,English,136 pages,Paperback,Published May 19th 2015 by Race Point Publishing (first published April 15th 2015),Food and Drink,Cassandra Reeder
6687,The Best 30-minute Recipe: A Best Recipe Classic,4.13,1455.0,41.0,0.0,English,278 pages,Hardcover,Published October 1st 2006 by America's Test Kitchen (first published September 30th 2006),Food and Drink,Cook's Illustrated
6707,Southern Cakes: Sweet and Irresistible Recipes for Everyday Celebrations,4.31,1605.0,31.0,0.0,English,168 pages,Paperback,Published June 7th 2007 by Chronicle Books,Food and Drink,Nancie McDermott
6727,Dinner: The Playbook: A 30-Day Plan for Mastering the Art of the Family Meal,3.83,732.0,89.0,0.0,English,240 pages,Paperback,Published August 26th 2014 by Ballantine Books (first published January 1st 2014),Food and Drink,Jenny Rosenstrach
6894,The Complete Cooking Light Cookbook,4.15,3546.0,19.0,0.0,English,528 pages,Hardcover,Published December 3rd 2005 by Oxmoor House (first published June 2000),Food and Drink,Cooking Light Magazine
6904,"Cradle of Flavor: Home Cooking from the Spice Islands of Indonesia, Singapore, and Malaysia",4.15,431.0,20.0,0.0,English,384 pages,Hardcover,Published August 17th 2006 by W. W. Norton Company,Food and Drink,James Oseland
7098,The Voyage of the Dawn Treader,4.09,442631.0,9282.0,0.0,English,248 pages,Hardcover,Published September 1st 2006 by HarperCollins (first published September 15th 1952),Fantasy,C.S. Lewis
7532,Fragile Things: Short Fictions and Wonders,3.96,67213.0,4306.0,4.0,English,384 pages,Paperback,Published January 25th 2022 by William Morrow (first published September 25th 2006),Fantasy,Neil Gaiman
7545,Ptolemy's Gate,4.27,83772.0,2384.0,3.0,English,501 pages,Hardcover,Published January 1st 2006 by Hyperion/Miramax (first published October 2005),Fantasy,Jonathan Stroud
7633,Sandry's Book,4.02,41942.0,1246.0,2.0,English,252 pages,Mass Market Paperback,Published June 24th 2006 by Scholastic (first published September 1st 1997),Fantasy,Tamora Pierce
7677,The Vampire Lestat,4.09,190990.0,4542.0,2.0,English,481 pages,Paperback,Published August 31st 2004 by Ballantine Books (first published 1985),Horror,Anne Rice
7820,East,4.14,42601.0,3094.0,3.0,English,507 pages,Paperback,Published May 1st 2005 by HMH Books for Young Readers (first published September 1st 2003),Fantasy,Edith Pattou
7919,Unearthly,4.02,125898.0,7900.0,1.0,English,435 pages,Hardcover,Published January 4th 2011 by HarperTeen,Young Adult,Cynthia Hand
8527,The Vampire Lestat,4.09,190990.0,4543.0,2.0,English,481 pages,Paperback,Published August 31st 2004 by Ballantine Books (first published 1985),Horror,Anne Rice
8584,The Signature of All Things,3.86,109453.0,12737.0,4.0,English,501 pages,Hardcover,Published October 1st 2013 by Riverhead Books,Fiction,Elizabeth Gilbert
8879,Awkward,4.17,45040.0,2395.0,3.0,English,224 pages,Paperback,Published July 21st 2015 by JY,Sequential Art,Svetlana Chmakova
8949,Illegal,4.23,8004.0,1433.0,0.0,English,144 pages,Kindle Edition,Published October 5th 2017 by Hodder Children's Books (first published October 4th 2017),Sequential Art,Eoin Colfer
9002,Calling Dr. Laura,3.83,6590.0,605.0,1.0,English,262 pages,Paperback,Published January 22nd 2013 by Mariner Books,Sequential Art,Nicole J. Georges
9111,My Boyfriend Is a Bear,3.85,3621.0,897.0,0.0,English,176 pages,Paperback,Published April 24th 2018 by Oni Press,Sequential Art,Pamela Ribon
9135,Goliath,3.95,5001.0,566.0,1.0,English,96 pages,Hardcover,Published February 28th 2012 by Drawn and Quarterly,Sequential Art,Tom Gauld
9164,Little Robot,4.06,4869.0,541.0,1.0,English,135 pages,Hardcover,Published September 1st 2015 by First Second,Sequential Art,Ben Hatke
9457,The Signature of All Things,3.86,109453.0,12736.0,4.0,English,501 pages,Hardcover,Published October 1st 2013 by Riverhead Books,Fiction,Elizabeth Gilbert
10057,My Cousin Rachel,3.99,52611.0,5752.0,0.0,English,352 pages,ebook,"Published December 17th 2013 by Little, Brown and Company (first published 1951)",Classics,Daphne du Maurier
10660,Return of a King: The Battle for Afghanistan,4.34,3899.0,581.0,3.0,English,515 pages,Hardcover,Published February 4th 2013 by Bloomsbury Publishing,History,William Dalrymple
10755,The Dead Hand: The Untold Story of the Cold War Arms Race and its Dangerous Legacy,4.15,4656.0,397.0,2.0,English,592 pages,Hardcover,Published September 22nd 2009 by Doubleday,History,David E. Hoffman
10881,The Thirty Years War: Europe's Tragedy,3.89,1463.0,166.0,1.0,English,997 pages,Hardcover,Published 2009 by Belknap Press,History,Peter H. Wilson
10932,The End: The Defiance and Destruction of Hitler's Germany 1944-45,4.14,4035.0,311.0,1.0,English,592 pages,Hardcover,Published September 8th 2011 by Penguin Press (first published August 25th 2011),History,Ian Kershaw
11440,The Imago Sequence and Other Stories,4.01,3789.0,383.0,3.0,English,248 pages,Hardcover,Published July 25th 2007 by Night Shade Books (first published January 1st 2007),Horror,Laird Barron
11527,Fragile Things: Short Fictions and Wonders,3.96,67213.0,4307.0,4.0,English,384 pages,Paperback,Published January 25th 2022 by William Morrow (first published September 25th 2006),Fantasy,Neil Gaiman
11721,My Dearest Darkest,3.8,2994.0,591.0,0.0,English,352 pages,Paperback,Published March 29th 2022 by Sourcebooks Fire,Horror,Kayla Cottingham
11984,You Don't Have to Say You Love Me,4.15,16971.0,2987.0,1.0,English,457 pages,Hardcover,"Published June 13th 2017 by Little, Brown and Company",Autobiography,Sherman Alexie
12022,"Redefining Realness: My Path to Womanhood, Identity, Love & So Much More",4.29,15366.0,1387.0,1.0,English,263 pages,Hardcover,Published February 4th 2014 by Atria Books,Nonfiction,Janet Mock
12082,Boy: Tales of Childhood,4.07,65352.0,3256.0,0.0,English,176 pages,Paperback,Published April 5th 2001 by Puffin Books (first published 1984),Nonfiction,Roald Dahl
12123,Born to Run,4.17,45040.0,5344.0,4.0,English,528 pages,Hardcover,Published September 27th 2016 by Simon Schuster,Nonfiction,Bruce Springsteen
12372,Lust & Wonder,3.84,9833.0,971.0,1.0,English,304 pages,Hardcover,Published March 29th 2016 by St. Martin's Press,Autobiography,Augusten Burroughs
12398,A Circle of Quiet,4.21,6457.0,739.0,0.0,English,246 pages,Paperback,Published January 1st 1984 by HarperOne (first published 1971),Autobiography,Madeleine L'Engle
12548,All Souls: A Family Story from Southie,4.07,12648.0,890.0,3.0,English,263 pages,Paperback,Published October 3rd 2000 by Ballantine Books (first published September 25th 1999),Nonfiction,Michael Patrick MacDonald
12560,A Queer and Pleasant Danger: The True Story of a Nice Jewish Boy Who Joins the Church of Scientology and Leaves Twelve Years Later to Become the Lovely Lady She is Today,3.94,3110.0,373.0,1.0,English,258 pages,Hardcover,Published May 1st 2012 by Beacon Press,Autobiography,Kate Bornstein
12570,"Prague Winter: A Personal Story of Remembrance and War, 1937-1948",4.02,7117.0,1162.0,1.0,English,467 pages,Hardcover,Published April 24th 2012 by HarperCollins Publishers,Nonfiction,Madeleine K. Albright
12656,The Office BFFs: Tales of The Office from Two Best Friends Who Were There,4.29,15366.0,1957.0,1.0,English,321 pages,ebook,Published May 17th 2022 by Dey Street Books,Nonfiction,Jenna Fischer
12723,I Am Ozzy,4.07,26410.0,1466.0,0.0,English,391 pages,Hardcover,Published January 1st 2010 by Grand Central Publishing (first published 2009),Music,Ozzy Osbourne
12771,"Ocean of Sound: Aether Talk, Ambient Sound and Imaginary Worlds",4.13,1455.0,77.0,0.0,English,320 pages,Paperback,Published February 22nd 2001 by Serpent's Tail (first published 1995),Music,David Toop
12912,Solo,3.95,12218.0,2261.0,2.0,English,463 pages,Kindle Edition,Published July 25th 2017 by Blink,Young Adult,Kwame Alexander
12918,Saucerful of Secrets: The Pink Floyd Odyssey,4.08,2274.0,78.0,0.0,English,348 pages,Paperback,Published June 1st 1992 by Delta (first published 1991),Music,Nicholas Schaffner
13061,"Catch a Wave: The Rise, Fall, and Redemption of the Beach Boys' Brian Wilson",3.97,1343.0,124.0,0.0,English,342 pages,Hardcover,Published July 25th 2006 by Rodale Books (first published June 16th 2006),Music,Peter Ames Carlin
13089,Creative Quest,3.95,3409.0,439.0,1.0,English,288 pages,Hardcover,Published April 24th 2018 by Ecco,Nonfiction,"Ahmir ""Questlove"" Thompson"
13098,Dancing With Myself,3.83,2631.0,368.0,0.0,English,352 pages,Kindle Edition,Published October 7th 2014 by Touchstone (first published October 2014),Music,Billy Idol
13159,Lennon: The Definitive Biography,4.06,1833.0,47.0,0.0,English,784 pages,Paperback,Published January 5th 1993 by Harper Perennial (first published April 15th 1986),Music,Ray Coleman
13166,This Is What It Sounds Like: What the Music You Love Says About You,3.83,732.0,161.0,0.0,English,288 pages,Hardcover,Published September 20th 2022 by W. W. Norton Company,Nonfiction,Susan Rogers
13193,A Romance on Three Legs: Glenn Gould's Obsessive Quest for the Perfect Piano,4.01,1104.0,118.0,0.0,English,272 pages,Hardcover,Published June 10th 2008 by Bloomsbury USA,Music,Katie Hafner
13217,A Song for a New Day,3.98,3857.0,853.0,3.0,English,384 pages,Kindle Edition,Published September 10th 2019 by Berkley,Science Fiction,Sarah Pinsker
13314,Beethoven: The Universal Composer,4.03,1785.0,124.0,0.0,English,256 pages,Hardcover,Published October 4th 2005 by Eminent Lives (first published January 1st 2005),Music,Edmund Morris
13467,Chaos,4.18,5337.0,520.0,0.0,English,432 pages,ebook,Published July 21st 2015 by Avon Impulse,Romance,Jamie Shaw
13749,Jackaby,3.83,28569.0,5015.0,2.0,English,299 pages,Hardcover,Published September 16th 2014 by Algonquin Young Readers,Fantasy,William Ritter
14003,My Cousin Rachel,3.99,52611.0,5753.0,0.0,English,352 pages,ebook,"Published December 17th 2013 by Little, Brown and Company (first published 1951)",Classics,Daphne du Maurier
14083,On What Grounds,3.69,15524.0,1656.0,0.0,English,275 pages,Mass Market Paperback,Published September 1st 2003 by Berkley Books,Mystery,Cleo Coyle
14297,Books Can Be Deceiving,3.84,9833.0,1326.0,0.0,English,282 pages,Mass Market Paperback,Published July 5th 2011 by Berkley Books,Mystery,Jenn McKinlay
14809,The Indifferent Stars Above: The Harrowing Saga of a Donner Party Bride,4.24,19064.0,2488.0,0.0,English,288 pages,Hardcover,Published April 28th 2009 by William Morrow,Nonfiction,Daniel James Brown
14823,Manufacturing Consent: The Political Economy of the Mass Media,4.24,19064.0,1015.0,0.0,English,412 pages,Paperback,Published 2002 by Pantheon (first published 1988),Politics,Edward S. Herman
14962,Boy: Tales of Childhood,4.07,65354.0,3256.0,0.0,English,176 pages,Paperback,Published April 5th 2001 by Puffin Books (first published 1984),Nonfiction,Roald Dahl
15004,Smarter Faster Better: The Secrets of Being Productive in Life and Business,3.9,31748.0,2396.0,1.0,English,400 pages,Hardcover,Published March 8th 2016 by Random House (first published March 2016),Nonfiction,Charles Duhigg
15154,War of the Foxes,4.14,5989.0,810.0,1.0,English,49 pages,Paperback,Published April 28th 2015 by Copper Canyon Press,Poetry,Richard Siken
15225,Faithful and Virtuous Night,3.96,4428.0,639.0,3.0,English,71 pages,Hardcover,"Published September 9th 2014 by Farrar, Straus and Giroux (first published September 6th 2014)",Poetry,Louise Glück
15257,Aimless Love: New and Selected Poems,4.18,5337.0,747.0,2.0,English,261 pages,Hardcover,Published October 22nd 2013 by Random House,Poetry,Billy Collins
15444,Winter Recipes from the Collective,4.03,1785.0,288.0,0.0,English,46 pages,Hardcover,"Published October 26th 2021 by Farrar, Straus and Giroux (first published October 19th 2021)",Poetry,Louise Glück
15456,The Undefeated,4.68,6142.0,1456.0,7.0,English,40 pages,Hardcover,Published April 2nd 2019 by Versify,Childrens,Kwame Alexander
15464,Good Bones,4.31,1605.0,227.0,0.0,English,99 pages,Paperback,"Published October 2nd 2017 by Tupelo Press, Inc. (first published October 1st 2017)",Poetry,Maggie Smith
15538,Whale Day: And Other Poems,4.07,1582.0,311.0,1.0,English,111 pages,Hardcover,Published September 29th 2020 by Random House,Poetry,Billy Collins
15626,How to Be Drawn,4.18,1013.0,123.0,4.0,English,112 pages,Paperback,Published March 31st 2015 by Penguin Books,Poetry,Terrance Hayes
15654,My Life Had Stood a Loaded Gun,3.85,2055.0,246.0,0.0,English,52 pages,Paperback,Published March 3rd 2016 by Penguin Classics (first published 1880),Poetry,Emily Dickinson
15671,"Collected Poems, 1912-1944",4.15,1931.0,43.0,0.0,English,672 pages,Paperback,Published February 17th 1986 by New Directions (first published 1944),Poetry,H.D.
15707,The Erotic Poems,4.08,2274.0,98.0,0.0,English,464 pages,Paperback,Published February 24th 1983 by Penguin Classics (first published -2),Poetry,Ovid
15912,Tell Me the Truth about Love,3.97,1343.0,116.0,0.0,English,40 pages,Paperback,Published October 4th 2005 by Faber and Faber (first published 1994),Poetry,W.H. Auden
16135,Smarter Faster Better: The Secrets of Being Productive in Life and Business,3.9,31748.0,2397.0,1.0,English,400 pages,Hardcover,Published March 8th 2016 by Random House (first published March 2016),Nonfiction,Charles Duhigg
16301,The Feeling of What Happens: Body and Emotion in the Making of Consciousness,4.01,3789.0,108.0,0.0,English,400 pages,Paperback,Published October 10th 2000 by Mariner Books (first published 1999),Psychology,António R. Damásio
16376,Proust and the Squid: The Story and Science of the Reading Brain,3.83,6590.0,825.0,0.0,English,308 pages,Hardcover,Published September 4th 2007 by Harper (first published 2007),Nonfiction,Maryanne Wolf
16422,The Nurture Assumption: Why Children Turn Out the Way They Do,4.12,1706.0,179.0,1.0,English,462 pages,Paperback,Published September 14th 1999 by Free Press (first published 1998),Psychology,Judith Rich Harris
16485,Mind in Society: The Development of Higher Psychological Processes,4.18,1013.0,59.0,0.0,English,159 pages,Paperback,Published October 15th 1980 by Harvard University Press (first published 1978),Psychology,Lev S. Vygotsky
16606,"Type Talk: The 16 Personality Types That Determine How We Live, Love, and Work",4.04,1883.0,66.0,0.0,English,289 pages,Paperback,Published September 1st 1989 by Dell (first published 1988),Psychology,Otto Kroeger
16636,"The Dark Side of the Light Chasers: Reclaiming Your Power, Creativity, Brilliance and Dreams",4.08,7466.0,547.0,0.0,English,208 pages,Paperback,Published June 1st 1999 by G P Putnam's Sons (first published May 18th 1998),Psychology,Debbie Ford
16645,The Extended Mind: The Power of Thinking Outside the Brain,4.06,1833.0,260.0,0.0,English,352 pages,Kindle Edition,Published June 8th 2021 by Houghton Mifflin Harcourt,Nonfiction,Annie Murphy Paul
17338,Unearthly,4.02,125898.0,7901.0,1.0,English,435 pages,Hardcover,Published January 4th 2011 by HarperTeen,Young Adult,Cynthia Hand
17804,Hacking Darwin: Genetic Engineering and the Future of Humanity,4.02,3025.0,378.0,1.0,English,327 pages,Hardcover,Published May 23rd 2019 by Sourcebooks (first published April 23rd 2019),Science,Jamie Metzl
17832,Unstoppable: Harnessing Science to Change the World,4.15,3546.0,419.0,0.0,English,341 pages,Hardcover,Published November 10th 2015 by St. Martin's Press,Science,Bill Nye
17901,Gory Details: Adventures from the Dark Side of Science,4.12,2314.0,332.0,0.0,English,336 pages,Hardcover,Published March 2nd 2021 by National Geographic Society,Nonfiction,Erika Engelhaupt
17941,Quantum: A Guide for the Perplexed,4.14,1868.0,134.0,0.0,English,280 pages,Paperback,Published September 1st 2004 by Orion Publishing (first published 2003),Science,Jim Al-Khalili
17953,Darwin Comes to Town: How the Urban Jungle Drives Evolution,4.07,1582.0,220.0,1.0,English,304 pages,Hardcover,Published April 3rd 2018 by Picador USA (first published February 8th 2018),Science,Menno Schilthuizen
18048,The Globe,3.94,6022.0,189.0,0.0,English,368 pages,Paperback,Published 2003 by Ebury Press (first published 2002),Fantasy,Terry Pratchett
18156,Darwin's Ghost: The Origin of Species Updated,3.89,1463.0,71.0,0.0,English,416 pages,Paperback,Published April 3rd 2001 by Ballantine Books (first published 1999),Science,Steve Jones
